CategoryID,CategoryName,Description,Picture
1,someone,Nunc purus.,0xFECDFFEFFBDFEFEDD5EFFFEECCFFEEDF
2,bulwarks,"In est risus, auctor sed, tristique in, tempus sit amet, sem. Fusce consequat.",0xEDDFEEEFCFEFFFD0FFDFDEEEEFCEFBEF
3,wreathes,Nullam varius. Nulla facilisi. Cras non velit nec nisi vulputate nonummy.,0xEFFFDEFDAEFFEDEEEFFEFFEFFFEFFDDD
4,sponsons,Pellentesque ultrices mattis odio. Donec vitae nisi.,0xCFEBECFFEEFFBEFEEDEEFECEFFFCEDFF
5,anode,Vestibulum sed magna at nunc commodo placerat.,0xEEBEEEEFFCEFFFFEFFDFEFEEFDEFDDEF
6,lapstrake,"Morbi quis tortor id nulla ultrices aliquet. Maecenas leo odio, condimentum id, luctus nec, molestie sed, justo.",0xFBFEFCFFCFFEFFFFDFEEFCFDDFFEDEFD
7,nylons,Praesent id massa id nisl venenatis lacinia. Aenean sit amet justo. Morbi ut odio.,0xFFEEEECFEFFFEEEFFFFEDEFFDFCFECFC
8,garnish,"Integer pede justo, lacinia eget, tincidunt eget, tempus vel, pede. Morbi porttitor lorem id ligula. Suspendisse ornare consequat lectus.",0xEEEEDBEC2FEDFEDFFFBFEDFDDFFFDCFF
9,cowlick,Donec dapibus. Duis at velit eu est congue elementum. In hac habitasse platea dictumst.,0xFFFFECFFEFFFCFBFFEFFEFFDFFCFEEFD
10,ciders,"In tempor, turpis nec euismod scelerisque, quam turpis adipiscing lorem, vitae mattis nibh ligula nec sem.",0xFFEFFFFFCDFFDFFEFEEFDFDDFFFEFFDE
11,isthmus,Cras non velit nec nisi vulputate nonummy.,0xDFFBFFFFFEFFFFEFFF9FCCEFEEEFEFFF
12,leavings,Duis bibendum. Morbi non quam nec dui luctus rutrum.,0x83FCFEFFFFDFDEEFECFDDFBFFFFFEFDD
13,sneerer,"Curabitur at ipsum ac tellus semper interdum. Mauris ullamcorper purus sit amet nulla. Quisque arcu libero, rutrum ac, lobortis vel, dapibus at, diam.",0xFF1FFFCFFDDFF0CFDCFFFEEBFDFFFEEE
14,rundlets,Nulla tellus. In sagittis dui vel nisl. Duis ac nibh.,0xECFEFFEFFBFFFFFFEFEEDFDFFFFCFFFF
15,bloodstone,"Quisque porta volutpat erat. Quisque erat eros, viverra eget, congue eget, semper rutrum, nulla. Nunc purus.",0xFFEFDCFEDFFCA0EEEFEFEFF9FFFEEFFF
16,shiners,Fusce consequat. Nulla nisl.,0xCEFFEFEEFFEFEFDE7FDFEAEFEDDEEFFD
17,pollack,Maecenas ut massa quis augue luctus tincidunt. Nulla mollis molestie lorem. Quisque ut erat.,0xCDEFEFDEEFBFFFFCFEFFEDEDAEFFCEDE
18,crimmers,Phasellus sit amet erat. Nulla tempus.,0xEFFEBFEDFFDFFFEEEEEFFBFFDDFFFDFF
19,mantra,"Donec semper sapien a libero. Nam dui. Proin leo odio, porttitor id, consequat in, consequat ut, nulla.",0xEFF9FFFFCFFFDFFFFF8FFCFDEDFEEFEF
20,blowholes,Integer ac neque. Duis bibendum.,0xEEECFFEFFFEEFEEFFEEFFFFEFEECFDEF
21,earthquake,"Proin leo odio, porttitor id, consequat in, consequat ut, nulla. Sed accumsan felis. Ut at dolor quis odio consequat varius.",0xFFFFFFBCFDCFCEEEFDFFFFFDFEFEFDAF
22,cowitch,Vivamus tortor.,0xFFFFFCEFFFEFCFFFEFBFFDFFFFFFEFCE
23,duppies,"Proin leo odio, porttitor id, consequat in, consequat ut, nulla. Sed accumsan felis. Ut at dolor quis odio consequat varius.",0xFEFEDFFEFFFEFCDFEFFEFFEFDFFFEFDF
24,confab,Etiam vel augue. Vestibulum rutrum rutrum neque.,0xFF4FFCEFCEFEDEFDFFDF8CFFFFBEDAFE
25,duckling,Vestibulum sed magna at nunc commodo placerat. Praesent blandit. Nam nulla.,0xEF9FFFFFE7CFFEEFEFFFEFFFFEEFFFFA
26,amine,"Integer pede justo, lacinia eget, tincidunt eget, tempus vel, pede.",0xFDFCDFEFE2FFDBCDDFFCFFEEDFFFECFE
27,macaws,Suspendisse potenti. In eleifend quam a odio.,0xFFFFEFFBDECFFFCEECFEFFFFFBFFFFFE
28,sunglow,Proin risus.,0xFDADEACFEEEEEEFDEEEEEFEEFFECFFFE
29,reptile,"Morbi odio odio, elementum eu, interdum eu, tincidunt in, leo. Maecenas pulvinar lobortis est. Phasellus sit amet erat.",0xEDFFEFCFCFEFFFCFDFCFFFFFFFFFDFEE
30,fryers,Nam tristique tortor eu pede.,0xFFCFEDEDFEFCFFFCFDCFFFFFBCDFDEAE
31,mossies,"In hac habitasse platea dictumst. Morbi vestibulum, velit id pretium iaculis, diam erat fermentum justo, nec condimentum neque sapien placerat ante.",0xFDFDFDEFFFFDCCEFFFBFBCFFFFEFDDEF
32,orang,Etiam justo. Etiam pretium iaculis justo.,0xFAFEDDEEFDFFFFFFFFFFDFFEEFDDBDED
33,lechers,Mauris sit amet eros.,0xCFEFFCFFFFFDFEFFFDFFEEEFFDFFFEFE
34,sclerite,"Donec ut dolor. Morbi vel lectus in quam fringilla rhoncus. Mauris enim leo, rhoncus sed, vestibulum sit amet, cursus id, turpis.",0xFE6FFECFFEFFFEDFEECFFDFDECFFEAEF
35,velum,Donec vitae nisi.,0xDEFEEFFFFFDEFDFEFFEFFEECFFDDEFFB
36,elder,Donec dapibus. Duis at velit eu est congue elementum.,0xDEFFEFFBFDEFFEFFFEEEFEECEEDCFFBF
37,earners,Duis consequat dui nec nisi volutpat eleifend. Donec ut dolor. Morbi vel lectus in quam fringilla rhoncus.,0xFFBFFCEFFFFCDFFDEFC6FFEDEFFEEFCF
38,ceilings,"Morbi odio odio, elementum eu, interdum eu, tincidunt in, leo. Maecenas pulvinar lobortis est.",0xFD2FEFCFFFFFDFBEFEEEFFFFCDEFEEFE
39,sublet,Pellentesque viverra pede ac diam. Cras pellentesque volutpat dui.,0xEDCFFFDDFEACFFDFCFFECFEEFFFFEDDF
40,modules,Duis consequat dui nec nisi volutpat eleifend.,0xEFEDFDFFFFFFFFCFEFFDFEFFFFFFFFFD
41,tercet,Maecenas pulvinar lobortis est.,0xFFFCFAFDCFCDE8FFAFDFDFEEEFFCEEFF
42,champac,Aliquam erat volutpat.,0xED9FFCCFFEDFFFFEFFFEFBEDECFFCCCD
43,berley,"Cras mi pede, malesuada in, imperdiet et, commodo vulputate, justo. In blandit ultrices enim. Lorem ipsum dolor sit amet, consectetuer adipiscing elit.",0xFAECFFDEFFFAEDDEFEFFEEFEFE6EEFEF
44,foxgloves,"Phasellus id sapien in sapien iaculis congue. Vivamus metus arcu, adipiscing molestie, hendrerit at, vulputate vitae, nisl. Aenean lectus.",0xBFEFFEEFFFFFFFDDFFDEBFEF3FEFCDFF
45,wheelwork,"Morbi vestibulum, velit id pretium iaculis, diam erat fermentum justo, nec condimentum neque sapien placerat ante. Nulla justo. Aliquam quis turpis eget elit sodales scelerisque.",0xFFFFFFFEEFDFEFFBEFBFDFDFFFFFFEFC
46,dunlins,Sed ante. Vivamus tortor. Duis mattis egestas metus.,0xFEFFFFFFACDFFADFFDEEFFDCECDEAFEE
47,cutler,Maecenas ut massa quis augue luctus tincidunt. Nulla mollis molestie lorem. Quisque ut erat.,0xE0DFFFFBECCDAF5FDFCEEDFCDFDFCAFE
48,hussar,Fusce posuere felis sed lacus.,0xFDEFFFFFDFECDFFFFFEFEEFEDEEFEFEE
49,cockshy,Nullam varius.,0xFEFFFBFDEDDEFEEEFEFC6FFFDDEFFEDB
50,audit,Vestibulum sed magna at nunc commodo placerat. Praesent blandit.,0xDFFEFEFEDAEDFEFFFEB8FAC8EFFFFFEF
51,leapfrogs,Aenean sit amet justo.,0xDFFEFDDFFFFFFEEEEAEFFAEFFFFAEFEF
52,rostrum,"Fusce posuere felis sed lacus. Morbi sem mauris, laoreet ut, rhoncus aliquet, pulvinar sed, nisl.",0xFFFFDFF4FFCCEFDFCEEFEBFFDADFFFBF
53,jointure,Duis consequat dui nec nisi volutpat eleifend. Donec ut dolor.,0xFEFFEFFEFEFEFFFFEFFDEFFFFFACEE8F
54,bistort,"Vivamus vel nulla eget eros elementum pellentesque. Quisque porta volutpat erat. Quisque erat eros, viverra eget, congue eget, semper rutrum, nulla.",0xFFEFDFFFCEFFEDFEECEEECFCFFEFFEFE
55,entr'acte,Nam tristique tortor eu pede.,0xFECFFDFFDEEEFFCCCEDFFDFEEFDFFDFF
56,chamades,"Morbi odio odio, elementum eu, interdum eu, tincidunt in, leo. Maecenas pulvinar lobortis est. Phasellus sit amet erat.",0xDDFFCCDFFEFCDEFFDEFDBAEFF7FEFEFE
57,bedbugs,Nunc purus. Phasellus in felis.,0xEDFEFFEFFEFEEBFFFEFE9FFFFFFFFEFD
58,cretics,"Praesent blandit. Nam nulla. Integer pede justo, lacinia eget, tincidunt eget, tempus vel, pede.",0xEFFBEFFCDDEDFFDFEEDEEFCFEFDCEFFF
59,shirtwaists,"Lorem ipsum dolor sit amet, consectetuer adipiscing elit.",0xEFFDFDCBCFEDFFDCEFCFEFECEF8EFEDF
60,lightings,Proin risus.,0xFFEDEDCFFDFEFEDFFDFEFFFEFFFDFECB
61,doornails,Etiam justo.,0xD1FFEFFCEFFEFDFFEFEDDFCFEDDEFFFF
62,bistre,Integer ac leo.,0xDDFFDFFFEFEDFEEFEEFEEDBFFEFD3FEE
63,loti,Nulla justo. Aliquam quis turpis eget elit sodales scelerisque. Mauris sit amet eros.,0xEEFFECFEFEFFFF9EFFDFDFFDCDEDFEEB
64,briber,Suspendisse accumsan tortor quis turpis. Sed ante. Vivamus tortor.,0xFECFFFEFFFFEBBEBEEDFFEDFFEEFEFFF
65,chauffeurs,Donec dapibus. Duis at velit eu est congue elementum. In hac habitasse platea dictumst.,0xFBFCFDEFDCEFEECFFBEFCDFFDEFDFFED
66,hidage,"Suspendisse potenti. Cras in purus eu magna vulputate luctus. Cum sociis natoque penatibus et magnis dis parturient montes, nascetur ridiculus mus.",0xFFDFDDFDFFCEECEFFFCDCFFEFCFDFFED
67,headlamps,Donec posuere metus vitae ipsum. Aliquam non mauris. Morbi non lectus.,0xFFFFDFFFFFFFDDFFFEEFEFFFFFEEFFEF
68,bookrest,Praesent lectus.,0xDBFFFEFFFF2FCFEBFFEDFEE5AFEEEFEB
69,dauties,In eleifend quam a odio. In hac habitasse platea dictumst. Maecenas ut massa quis augue luctus tincidunt.,0xCFEFFFCEFFFFFFEFFAEFEFBBFDADEEEE
70,rebuke,Aliquam non mauris.,0xCFFFFFFDCDFEEFECDBEFFBFFEFCECFEF
71,souters,"Phasellus id sapien in sapien iaculis congue. Vivamus metus arcu, adipiscing molestie, hendrerit at, vulputate vitae, nisl. Aenean lectus.",0xFFFFBDCCEBCFEFF9EFEECEFFFCAFDEEE
72,catchwords,Donec vitae nisi.,0xFEEEFEEFCFFDFFFFFFDFCD7DEEEFEFCE
73,obstructs,"Mauris enim leo, rhoncus sed, vestibulum sit amet, cursus id, turpis. Integer aliquet, massa id lobortis convallis, tortor risus dapibus augue, vel accumsan tellus nisi eu orci. Mauris lacinia sapien quis libero.",0xDFDFFFFFEEFFDEFFCFFEEFFFFFFFFFED
74,ointments,Vivamus tortor.,0xDEFE5AFFFEFFFEEBFBFEFBEFEFFBFFFF
75,brangle,"Nulla ac enim. In tempor, turpis nec euismod scelerisque, quam turpis adipiscing lorem, vitae mattis nibh ligula nec sem. Duis aliquam convallis nunc.",0xDFCCFFFDCFFFDFFEFFFEF4FFDFEFEFFE
76,sowar,Etiam faucibus cursus urna.,0xBFFECFEEFFFECFFEEDFFFEEFFFFFFFFF
77,edit,"Fusce congue, diam id ornare imperdiet, sapien urna pretium nisl, ut volutpat sapien arcu sed augue.",0xFDFECFECFEDDFFFEFFFEFFEFDFEDAF7E
78,painting,"Quisque arcu libero, rutrum ac, lobortis vel, dapibus at, diam. Nam tristique tortor eu pede.",0xCDFCEEAEFEDFDFBFEEFFFFEFFFDDEDFA
79,tackler,Integer ac leo. Pellentesque ultrices mattis odio.,0xFFFDFBFFEFFEEFFEEFEFFFFEFEEFECDF
80,dinars,"Proin at turpis a pede posuere nonummy. Integer non velit. Donec diam neque, vestibulum eget, vulputate ut, ultrices vel, augue.",0x1FFDFFFFFFFDEECDCFCFCCFFEEEFBDFF
